{
  "$schema": "https://json-schema.org/draft/2020-12/schema",
  "$id": "worldskills-platform/module.schema.json",
  "title": "Module",
  "type": "object",
  "required": ["id", "title", "description", "lessonOrder", "taskIds"],
  "properties": {
    "id": { "type": "string", "pattern": "^[a-z0-9-]+$" },
    "title": { "type": "string", "minLength": 1 },
    "description": { "type": "string" },
    "lessonOrder": { "type": "array", "items": { "type": "string" } },
    "taskIds": { "type": "array", "items": { "type": "string" } },
    "icon": { "type": "string" },
    "accent": { "type": "string" }
  },
  "additionalProperties": false
}
